{
  "schema_version": "2.0",
  "repo_revision": {
    "ref": "WORKTREE",
    "commit": "11db8408e7c0421cc06760d432a595ce38d2d0c5",
    "kind": "worktree",
    "worktree": {
      "included": true,
      "staged": 0,
      "unstaged": 0,
      "untracked": 0
    }
  },
  "base_revision": {
    "ref": "main",
    "commit": "ce14de83f5c913f7d82e33148d4b92bb940ff671",
    "merge_base": "ce14de83f5c913f7d82e33148d4b92bb940ff671",
    "diff_mode": "merge-base"
  },
  "repository": {
    "name": "impact-check-demo",
    "is_shallow": false,
    "ts_config": "tsconfig.json",
    "workspace_packages": [
      {
        "name": "shop-demo",
        "path": "."
      }
    ],
    "context": {
      "languages": [
        {
          "language": "typescript",
          "files": 7
        },
        {
          "language": "json",
          "files": 2
        },
        {
          "language": "markdown",
          "files": 1
        },
        {
          "language": "sql",
          "files": 1
        }
      ],
      "module_type": "module",
      "workspace_tools": [],
      "test_frameworks": [],
      "module_resolution": "bundler"
    }
  },
  "summary": {
    "analysis_mode": "full",
    "files_changed": 4,
    "js_ts_files_changed": 3,
    "affected_modules": 8,
    "findings_by_severity": {
      "high": 1,
      "medium": 4,
      "low": 1,
      "info": 1
    },
    "findings_by_status": {
      "verified_static_fact": 2,
      "hypothesis": 5,
      "unknown": 0
    },
    "test_candidates": 2,
    "coverage_limitations": 4
  },
  "changed_files": [
    {
      "path": "db/migrations/002_add_currency.sql",
      "previous_path": null,
      "status": "added",
      "binary": false,
      "generated": false,
      "language": "other",
      "kind": "other",
      "additions": 1,
      "deletions": 0,
      "origin": "committed",
      "changed_lines": [
        {
          "start": 1,
          "end": 1
        }
      ],
      "provenance": "observed"
    },
    {
      "path": "src/auth/session.ts",
      "previous_path": null,
      "status": "modified",
      "binary": false,
      "generated": false,
      "language": "typescript",
      "kind": "source",
      "additions": 1,
      "deletions": 1,
      "origin": "committed",
      "changed_lines": [
        {
          "start": 3,
          "end": 3
        }
      ],
      "provenance": "observed"
    },
    {
      "path": "src/lib/legacy-tax.ts",
      "previous_path": null,
      "status": "deleted",
      "binary": false,
      "generated": false,
      "language": "typescript",
      "kind": "source",
      "additions": 0,
      "deletions": 1,
      "origin": "committed",
      "changed_lines": [],
      "provenance": "observed"
    },
    {
      "path": "src/lib/money.ts",
      "previous_path": null,
      "status": "modified",
      "binary": false,
      "generated": false,
      "language": "typescript",
      "kind": "source",
      "additions": 2,
      "deletions": 2,
      "origin": "committed",
      "changed_lines": [
        {
          "start": 1,
          "end": 2
        }
      ],
      "provenance": "observed"
    }
  ],
  "affected_modules": [
    {
      "path": "src/auth/session.ts",
      "reason": "changed",
      "distance": 0,
      "provenance": "observed",
      "via": [
        "src/auth/session.ts"
      ],
      "changed_roots": [
        "src/auth/session.ts"
      ],
      "evidence": []
    },
    {
      "path": "src/lib/legacy-tax.ts",
      "reason": "changed",
      "distance": 0,
      "provenance": "observed",
      "via": [
        "src/lib/legacy-tax.ts"
      ],
      "changed_roots": [
        "src/lib/legacy-tax.ts"
      ],
      "evidence": []
    },
    {
      "path": "src/lib/money.ts",
      "reason": "changed",
      "distance": 0,
      "provenance": "observed",
      "via": [
        "src/lib/money.ts"
      ],
      "changed_roots": [
        "src/lib/money.ts"
      ],
      "evidence": []
    },
    {
      "path": "src/cart/cart.ts",
      "reason": "dependent",
      "distance": 1,
      "provenance": "graph",
      "via": [
        "src/lib/legacy-tax.ts",
        "src/cart/cart.ts"
      ],
      "changed_roots": [
        "src/lib/legacy-tax.ts",
        "src/lib/money.ts"
      ],
      "evidence": [
        {
          "kind": "import-edge",
          "path": "src/cart/cart.ts",
          "side": "base",
          "line_start": 2,
          "line_end": 2,
          "commit": "ce14de83f5c913f7d82e33148d4b92bb940ff671",
          "detail": "imports \"../lib/legacy-tax\" → src/lib/legacy-tax.ts"
        }
      ]
    },
    {
      "path": "src/cart/cart.test.ts",
      "reason": "dependent",
      "distance": 2,
      "provenance": "graph",
      "via": [
        "src/lib/legacy-tax.ts",
        "src/cart/cart.ts",
        "src/cart/cart.test.ts"
      ],
      "changed_roots": [
        "src/lib/legacy-tax.ts",
        "src/lib/money.ts"
      ],
      "evidence": [
        {
          "kind": "import-edge",
          "path": "src/cart/cart.test.ts",
          "side": "head",
          "line_start": 1,
          "line_end": 1,
          "commit": null,
          "detail": "imports \"./cart\" → src/cart/cart.ts"
        }
      ]
    },
    {
      "path": "src/checkout/checkout.ts",
      "reason": "dependent",
      "distance": 2,
      "provenance": "graph",
      "via": [
        "src/lib/legacy-tax.ts",
        "src/cart/cart.ts",
        "src/checkout/checkout.ts"
      ],
      "changed_roots": [
        "src/lib/legacy-tax.ts",
        "src/lib/money.ts"
      ],
      "evidence": [
        {
          "kind": "import-edge",
          "path": "src/checkout/checkout.ts",
          "side": "head",
          "line_start": 1,
          "line_end": 1,
          "commit": null,
          "detail": "imports \"../cart/cart\" → src/cart/cart.ts"
        }
      ]
    },
    {
      "path": "src/index.ts",
      "reason": "dependent",
      "distance": 3,
      "provenance": "graph",
      "via": [
        "src/lib/legacy-tax.ts",
        "src/cart/cart.ts",
        "src/checkout/checkout.ts",
        "src/index.ts"
      ],
      "changed_roots": [
        "src/lib/legacy-tax.ts",
        "src/lib/money.ts"
      ],
      "evidence": [
        {
          "kind": "import-edge",
          "path": "src/index.ts",
          "side": "head",
          "line_start": 1,
          "line_end": 1,
          "commit": null,
          "detail": "imports \"./checkout/checkout\" → src/checkout/checkout.ts"
        }
      ]
    },
    {
      "path": "test/checkout.test.ts",
      "reason": "dependent",
      "distance": 3,
      "provenance": "graph",
      "via": [
        "src/lib/legacy-tax.ts",
        "src/cart/cart.ts",
        "src/checkout/checkout.ts",
        "test/checkout.test.ts"
      ],
      "changed_roots": [
        "src/lib/legacy-tax.ts",
        "src/lib/money.ts"
      ],
      "evidence": [
        {
          "kind": "import-edge",
          "path": "test/checkout.test.ts",
          "side": "head",
          "line_start": 1,
          "line_end": 1,
          "commit": null,
          "detail": "imports \"../src/checkout/checkout\" → src/checkout/checkout.ts"
        }
      ]
    }
  ],
  "findings": [
    {
      "id": "broken-import:de5c41fc",
      "rule_id": "broken-import",
      "category": "broken-import",
      "severity": "high",
      "status": "verified_static_fact",
      "confidence": "high",
      "is_heuristic": false,
      "provenance": "graph",
      "summary": "Import of deleted module no longer resolves: src/lib/legacy-tax.ts",
      "explanation": "In the base graph these modules resolved an import to src/lib/legacy-tax.ts, which was deleted. In the head state the same import specifier cannot be resolved by dependency-cruiser. Unless resolution depends on configuration Impact Check does not see (e.g. bundler aliases), this import is broken.",
      "recommended_human_action": "Update or remove the import, or restore the module; then run the listed test candidates.",
      "evidence": [
        {
          "kind": "file-status",
          "path": "src/lib/legacy-tax.ts",
          "side": "base",
          "line_start": null,
          "line_end": null,
          "commit": "ce14de83f5c913f7d82e33148d4b92bb940ff671",
          "detail": "deleted"
        },
        {
          "kind": "import-edge",
          "path": "src/cart/cart.ts",
          "side": "head",
          "line_start": 2,
          "line_end": 2,
          "commit": null,
          "detail": "imports \"../lib/legacy-tax\" (no longer resolves)"
        }
      ],
      "affected_modules": [
        "src/cart/cart.ts",
        "src/lib/legacy-tax.ts"
      ]
    },
    {
      "id": "deleted-module-with-dependents:38ddabca",
      "rule_id": "deleted-module-with-dependents",
      "category": "deleted-module",
      "severity": "medium",
      "status": "verified_static_fact",
      "confidence": "high",
      "is_heuristic": false,
      "provenance": "graph",
      "summary": "Deleted module had 1 dependent(s) in base: src/lib/legacy-tax.ts",
      "explanation": "1 of these dependents were not modified in this change. Verify they no longer rely on src/lib/legacy-tax.ts.",
      "recommended_human_action": "Verify that no remaining code (including dynamic imports and other repositories) relies on the old path.",
      "evidence": [
        {
          "kind": "file-status",
          "path": "src/lib/legacy-tax.ts",
          "side": "base",
          "line_start": null,
          "line_end": null,
          "commit": "ce14de83f5c913f7d82e33148d4b92bb940ff671",
          "detail": "deleted"
        },
        {
          "kind": "import-edge",
          "path": "src/cart/cart.ts",
          "side": "base",
          "line_start": null,
          "line_end": null,
          "commit": "ce14de83f5c913f7d82e33148d4b92bb940ff671",
          "detail": "imported \"../lib/legacy-tax\""
        }